{
  "$schema": "https://json-schema.org/draft/2020-12/schema",
  "$id": "drama-studio/run-handoff/v0",
  "title": "一次工位运行的交接",
  "type": "object",
  "additionalProperties": false,
  "required": [
    "schemaVersion",
    "runId",
    "taskId",
    "workstation",
    "methodVersion",
    "contextSnapshotId",
    "host",
    "outputs",
    "stateChangeProposals",
    "changeProposals",
    "status",
    "unfinished",
    "nextAction"
  ],
  "properties": {
    "schemaVersion": {
      "const": "drama-studio/run-handoff/v0"
    },
    "runId": {
      "type": "string",
      "minLength": 1
    },
    "taskId": {
      "type": "string",
      "minLength": 1
    },
    "workstation": {
      "type": "string",
      "enum": [
        "C1",
        "C2",
        "C3",
        "C4",
        "C5",
        "C6"
      ]
    },
    "methodVersion": {
      "type": "string",
      "minLength": 1
    },
    "contextSnapshotId": {
      "type": [
        "string",
        "null"
      ],
      "minLength": 1,
      "description": "null only for C1/C2 runs, which pack no context (D6-2); they say why in noSnapshotReason"
    },
    "noSnapshotReason": {
      "type": "string",
      "minLength": 1,
      "description": "Required when contextSnapshotId is null (C1/C2 only)"
    },
    "additionalSnapshotIds": {
      "type": "array",
      "items": {
        "type": "string",
        "minLength": 1
      },
      "description": "Optional: further context-snapshot IDs this run also read (e.g. C6 first and second read packages); impact marks the run stale when any of them is stale"
    },
    "finishedAt": {
      "type": "string",
      "pattern": "^\\d{4}-\\d{2}-\\d{2}T\\d{2}:\\d{2}(:\\d{2}(\\.\\d{3}|\\.\\d{6})?)?(Z|[+-]\\d{2}:\\d{2})$",
      "description": "Optional: when the run finished, ISO 8601 with a UTC offset; status orders runs by it and falls back to file mtime when it is absent"
    },
    "host": {
      "type": "object",
      "additionalProperties": false,
      "required": [
        "name",
        "usage"
      ],
      "properties": {
        "name": {
          "type": "string",
          "minLength": 1
        },
        "model": {
          "type": [
            "string",
            "null"
          ]
        },
        "usage": {
          "type": "object",
          "additionalProperties": false,
          "required": [
            "source"
          ],
          "properties": {
            "source": {
              "type": "string",
              "enum": [
                "host_reported",
                "estimated",
                "unknown"
              ]
            },
            "calls": {
              "type": "integer",
              "minimum": 0
            },
            "chars": {
              "type": "integer",
              "minimum": 0
            },
            "tokens": {
              "type": [
                "integer",
                "null"
              ],
              "minimum": 0
            }
          }
        }
      }
    },
    "outputs": {
      "type": "array",
      "items": {
        "$ref": "#/$defs/ref"
      }
    },
    "stateChangeProposals": {
      "type": "array",
      "items": {
        "type": "object",
        "additionalProperties": false,
        "required": [
          "claim",
          "evidence"
        ],
        "properties": {
          "claim": {
            "type": "string",
            "minLength": 1
          },
          "evidence": {
            "$ref": "#/$defs/ref"
          },
          "ledgerDelta": {
            "type": "object",
            "required": [
              "episode",
              "track",
              "reads",
              "writes"
            ],
            "properties": {
              "episode": {
                "type": [
                  "integer",
                  "string"
                ]
              },
              "track": {
                "type": "string",
                "enum": [
                  "planned",
                  "actual"
                ]
              },
              "reads": {
                "type": "array",
                "items": {
                  "type": "string",
                  "minLength": 1
                }
              },
              "writes": {
                "type": "array",
                "items": {
                  "type": "object",
                  "required": [
                    "entryId",
                    "change",
                    "reason"
                  ]
                }
              }
            },
            "description": "Optional (D6): structured ledger-delta; the old claim/evidence pair stays valid"
          }
        }
      }
    },
    "changeProposals": {
      "type": "array",
      "items": {
        "type": "object",
        "additionalProperties": false,
        "required": [
          "targetLayer",
          "problem",
          "evidence",
          "proposedChange",
          "unknownScope",
          "needsDecision"
        ],
        "properties": {
          "targetLayer": {
            "type": "string",
            "enum": [
              "C1",
              "C2",
              "C3",
              "C4",
              "C5",
              "C6"
            ]
          },
          "problem": {
            "type": "string",
            "minLength": 1
          },
          "evidence": {
            "$ref": "#/$defs/ref"
          },
          "proposedChange": {
            "type": "string",
            "minLength": 1
          },
          "affected": {
            "type": "array",
            "items": {
              "$ref": "#/$defs/ref"
            }
          },
          "unknownScope": {
            "type": "string"
          },
          "protectedLosses": {
            "type": "array",
            "items": {
              "type": "string",
              "minLength": 1
            }
          },
          "needsDecision": {
            "type": "boolean"
          },
          "kind": {
            "type": "string",
            "enum": [
              "setting_conflict",
              "premise",
              "license",
              "capacity",
              "upstream_change",
              "other"
            ],
            "description": "Optional (D6): decision-queue kind, for decision add --from-handoff"
          },
          "options": {
            "type": "array",
            "items": {
              "type": "object",
              "required": [
                "optionId",
                "text"
              ],
              "properties": {
                "optionId": {
                  "type": "string",
                  "minLength": 1
                },
                "text": {
                  "type": "string",
                  "minLength": 1
                }
              }
            },
            "description": "Optional (D6): options the lead can choose from"
          },
          "default": {
            "type": "string",
            "minLength": 1,
            "description": "Optional (D6): the optionId the flow follows until the lead decides"
          },
          "defaultReason": {
            "type": "string",
            "minLength": 1
          },
          "decisionId": {
            "type": "string",
            "minLength": 1,
            "description": "Optional (D6): the decision-queue entry this proposal was registered as"
          }
        }
      }
    },
    "status": {
      "type": "object",
      "additionalProperties": false,
      "required": [
        "run",
        "goal"
      ],
      "properties": {
        "run": {
          "type": "string",
          "enum": [
            "planned",
            "running",
            "interrupted",
            "finished",
            "failed"
          ]
        },
        "goal": {
          "type": "string",
          "enum": [
            "not_assessed",
            "met",
            "partially_met",
            "not_met",
            "insufficient_evidence"
          ]
        }
      }
    },
    "unfinished": {
      "type": "array",
      "items": {
        "type": "string",
        "minLength": 1
      }
    },
    "nextAction": {
      "type": "string",
      "minLength": 1
    },
    "unknowns": {
      "type": "array",
      "items": {
        "type": "string",
        "minLength": 1
      },
      "description": "Honest unknowns that no other field can express"
    },
    "readScope": {
      "type": "array",
      "items": {
        "type": [
          "string",
          "object"
        ]
      },
      "description": "Optional (D6): what this run actually read (self-reported, for the checker to know what to re-check)"
    }
  },
  "$defs": {
    "ref": {
      "type": "object",
      "additionalProperties": false,
      "required": [
        "kind",
        "id",
        "revision"
      ],
      "properties": {
        "kind": {
          "type": "string",
          "enum": [
            "remote_artifact",
            "remote_page",
            "remote_snapshot",
            "remote_brief",
            "local_file",
            "knowledge_card",
            "context_snapshot",
            "remote_receipt"
          ]
        },
        "id": {
          "type": "string",
          "minLength": 1
        },
        "revision": {
          "type": [
            "integer",
            "string",
            "null"
          ]
        },
        "sha256": {
          "type": "string",
          "pattern": "^sha256:[a-f0-9]{64}$"
        },
        "range": {
          "type": "object",
          "additionalProperties": false,
          "required": [
            "start",
            "end"
          ],
          "properties": {
            "start": {
              "type": "integer",
              "minimum": 0
            },
            "end": {
              "type": "integer",
              "minimum": 0
            }
          }
        }
      }
    }
  }
}
